id,text,anger,fear,joy,sadness,surprise
,My ankle feels better but my knee is swollen.,0,0,1,1,0
,"Negative, you will never catch me.",0,1,1,0,1
,I feel like my heart is in the wrong place.,0,0,1,0,0
,A lot of things I don't have are because I used to play halo and met a lot of them in person at the tournaments.,0,0,1,0,0
,"On those mornings, the sun seems brighter, it seems to spread happiness with my eyes.",0,0,1,0,0
,"I said, ""Hey, wait a second, one of the songs' titles sounds familiar...""",0,0,1,0,1
,I think I got my first successful independent adult relationship after finishing college.,0,0,1,0,0
,"As the girl behind me flows hot water through my hair, I feel the tension that slowly shrinks inside of me.",0,0,1,0,0
,After I had my hair done the sun was out and bright on my right side.,0,0,1,0,0
,"In college, I had a part-time accountant job and a good boss.",0,0,1,0,0
,"If I stand in front of the elevator bank, I will choose one and it will be the first to happen.",0,0,1,0,1
,"After about 30 seconds, something in my brain told me that my front door does not open by pressing the button on the key multiple times.",0,0,1,0,1
,The fellow first graders were awesome and either felt sorry for me or forgot about him.,0,0,1,1,0
,They were trying to get close because I missed my eyebrows.,0,0,1,0,0
,The bride's party is on the bride's street.,0,0,1,0,0
,He fell asleep on the couch.,0,0,1,0,0
,My calves hurt for three days because I danced so much.,0,0,1,0,0
,It was a good hit.,0,0,1,0,0
,I keep an eye on the tissue.,0,0,1,0,0
,The greatest gift of all time is my labrador puppy.,0,0,1,0,1
,Shadows If new CD  Threads of Life' can be placed next to The Art of Balance and The War Within.,0,0,1,0,0
,She laughs because she is very nervous.,0,1,1,0,0
,Get a perfectly healthy person of mind.,0,1,1,0,0
,Best friends since.,0,0,1,0,0
,There was a soft pink sky with the sun shining gently over the roofs and a black woman singing near me.,0,1,1,1,1
,"I know you like her, but I beat you for it.",0,0,1,0,0
,I drank three beers when I was six years old.,0,0,1,0,0
,The security guard allowed me to stay.,0,0,1,0,0
,My father was a cyclist.,0,0,1,0,0
,We moved G to his own bedroom and cot from the master bedroom.,0,0,1,0,0
,"The treatment for my original complaint consisted of aChiropractic manipulation of my hip and pressure on certain nerves, a massage on my back, and an assortment of needles inserted into strategic points.",0,0,1,0,0
,"Today, I cleaned my hands with the boys shovelling land, throwing rocks, and picking up pieces of rotten wood, everything that the shovel dug up yesterday and left in a big, unshakeable pile.",0,0,1,0,0
,"My life is the epitome of clumsiness, but I can't beat surgery.",0,1,1,1,0
,"I thought it was beautiful, but I was pretty sure it was extensions.",0,0,1,0,1
,I learned a lot during my visit.,0,0,1,0,0
,I can raise my arms above my head.,0,0,1,0,0
,I want to do more with my brain and live more of what he can do.,0,0,1,0,0
,"There was a fish tank with two fish, a bottomfeeder and an angel fish.",0,0,1,0,0
,I met a lot of Canadians that night.,0,0,1,0,1
,I'm happy you're home.,0,0,1,0,0
,"After two more seconds, we cross the parking fence and stop next to the edge of the street.",0,1,1,0,1
,I ate at a bar in Ethiopia.,0,0,1,0,0
,I had a smile on my face when I drove that song home.,0,0,1,0,0
,I took the cold spray on my face after it got so hot.,0,0,1,0,1
,I was on my way to the game.,0,0,1,0,0
,The keys in door sounds were enough to keep me safe.,0,0,1,0,0
,Everyone tells their beautiful stories.,0,0,1,0,0
,It was delicious.,0,0,1,0,0
,He hovered behind my house after I waved with one hand in a friendly way.,0,1,1,0,1
,I broke out laughing and hurried to cover my mouth after Mr. Jackson told me to ask you so he didn't have to call me.,0,0,1,0,1
,I like eyebrows.,0,0,1,0,0
,The trip there is important.,0,0,1,0,0
,I'll see my grandma at the dining table.,0,0,1,0,0
,I left.,0,0,1,0,0
,The mattress is above my waist.,0,0,1,0,0
,"The humidity ruined us both after only 2 songs, but I had an obvious wet spot all the way, that I didn't bother doing anything but flash the whole club from the stage.",0,0,1,1,0
,I grinned when I saw the sad Ceres.,0,0,1,0,0
,I traveled through time.,0,1,1,0,1
,"As I smile, my eyebrows go up.",0,0,1,0,0
,Please let us know if you have any questions.,0,0,1,0,0
,"When he woke up and fell asleep, I kept it.",0,0,1,0,0
,We went to City Island to see what they were doing to me.,0,0,1,0,0
,We walk on the dance floor and find two attractive girls who we choose to dance with.,0,0,1,0,0
,We were going to ruin the record.,0,0,1,0,0
,"When we heard a big bang and saw a bright white flash, we went back to the beach.",0,1,1,0,1
,It's not bad because Hawaiian is my first language.,0,0,1,0,0
,I went to do my nails after warming up.,0,0,1,0,0
,Everything was closed for the day because of my legs.,0,0,1,0,0
,We arrived in a city that blew my mind.,0,0,1,0,1
,We went under the sun and got splashed in my eyes with water.,0,0,1,0,0
,The layout of the body was decorated by Esm.,0,0,1,0,0
,"There were three outstanding incidents, but it was a pleasant night.",0,0,1,0,0
,I brought it to my kindergarten class to watch a movie.,0,0,1,0,0
,I remember being able to see with my eyes closed.,0,1,1,0,1
,I admire the store you run.,0,0,1,0,0
,"When we got into bed, we fell asleep.",0,0,1,0,0
,He was by my side as I traveled through Edinburgh.,0,0,1,0,0
,A few things off my chest is a nice way to do it.,0,0,1,0,0
,"There were some popsicles that made me turn my tongue in a shade of blue, and we visited the A&S display for children.",0,0,1,0,0
,Throw the tote on my shoulder and grab the larger bag.,0,0,1,0,0
,He had a farewell party.,0,0,1,0,0
,I liked spending my nights at home hula hooping and listening to music.,0,0,1,0,0
,It was exciting to find a way to escape gravity and move through my room like I was in the International Space Station.,0,0,1,0,1
,I will ask Jane for her cell number one day.,0,1,1,0,0
,They decided to throw me a birthday party.,0,0,1,0,1
,I have never had so much pain in my cheeks to smile or laugh.,0,0,1,0,0
,He celebrated after hitting Katahdin.,1,0,1,0,0
,I was told that one day I would be his wife.,0,0,1,0,1
,We shared a few moments of spaz dancing and singing before we parted ways.,0,0,1,0,0
,I look at his pictures and see something in my head.,0,0,1,0,1
,I closed my eyes and felt the elements around me.,0,0,1,0,0
,She decided to see the doctor.,0,1,1,0,0
,I felt like Batman.,0,0,1,0,0
,I lived in my first apartment when I was 21.,0,0,1,0,0
,My heart was beautiful.,0,0,1,0,0
,They decided to be roommates.,0,0,1,0,0
,The funniest thing I've ever seen on AGES was the last time I watched it on TVO and I cried because I was laughing so loud.,0,0,1,0,0
,A calm breeze crosses my face and shoulders.,0,0,1,0,0
,I saw them all.,0,0,1,0,1
,I enjoy telling this story.,0,0,1,0,0
,"I went to the gym for three weeks and lost eight pounds, and about twelve inches in total, including three of my waist, two of my hips, and four of my torso.",0,0,1,0,0
,He looks at me and I can see that I have a huge smile on my face.,0,1,1,0,0
,"When I think about it, it's amazing.",0,0,1,0,0
,Is it too scary?,0,1,1,0,1
,It fits my head.,0,0,1,0,0
,I played a game on my birthday.,0,0,1,0,0
,A song made me think.,0,1,1,0,0
,I'm with you.,0,0,1,0,0
,That was great.,0,0,1,0,0
,"The guests were all drunk, but they were friends of mine.",0,0,1,0,0
,I've been chewing undigested gum.,0,1,1,0,1
,Some children offered me water and hit me on the back.,0,0,1,0,0
,I got up and took the dust out of his belongings.,0,0,1,0,0
,I was farted and a Nugget fell to the ground.,0,0,1,0,1
,We had a dance party in the basement of a friend's house.,0,0,1,0,0
,"I know it's true because my glasses have been gone for over 16 years, and I know what to do and what not to do to have my sight relax, my vision stay sharp, and my eyes happy.",0,0,1,0,0
,It's possible to actually hacking on hand.,0,0,1,0,1
,The crowd goes crazy when the stranger crosses the finish line.,0,0,1,0,1
,His dad is his real dad.,0,0,1,0,0
,"Every day at the same time Jesus signed in the guest register, I found myself laughing.",0,0,1,0,1
,We're still best friends 14 years later.,0,0,1,0,0
,Not very happy.,0,0,1,1,0
,A little weird.,0,1,1,0,1
,It was right for me to take this job.,0,0,1,0,0
,The new apples are in my eye.,0,0,1,0,0
,"I had fun, my back didn't hurt me, and I felt great after the game was over.",0,0,1,0,0
,"I ran and bought 4 tickets for a show in Philidelphia PA, which is the only non-NY / CA show.",0,0,1,0,1
,I took a nap in the cabin because there was nothing else to do.,0,0,1,0,0
,This was even more important to me.,0,0,1,0,0
,My whole body was lighter.,0,0,1,0,0
,Let's get there and order drinks.,0,0,1,0,0
,Please excuse the spelling.,0,0,1,0,0
,The police decoy is revealed to be my black car from 1977.,0,0,1,0,1
,I spent a few hours early in the morning loading stuff because I was a vampire and hung by the toes during the morning hours.,0,0,1,0,0
,I want to know about your day.,0,0,1,0,0
,I remember sitting on the curb and listening to music.,0,0,1,0,0
,I stretched my muscles and looked at meat ribbons.,0,0,1,0,0
,"We live 9000 miles apart and neither of us have a lot of money, so hopefully we will meet in person at some point.",0,1,1,1,0
,The bride was in the aisle.,0,0,1,0,1
,We have been married for almost nine years.,0,0,1,0,0
,"The hike was pleasant at first, walking on a slight slope, enjoying the landscape, and seeing a lot of soft jaysis, I thought, ""Ah!""",0,1,1,0,1
,My eyes have been opened to the power of writing so far in this class.,0,0,1,0,0
,There are no planned wordplays on either account.,0,1,1,0,1
,We decided to meet after I talked to the lady online.,0,1,1,0,0
,Everything else is gone when I feel the sand under my feet and the roar of the waves and the strength of the winds of the gulf push and pull the water in a sacred movement.,0,0,1,0,0
,The bathroom was well furnished and elegant.,0,0,1,0,0
,I went to a wedding on Broadway.,0,0,1,0,1
,I had a funny idea in my head to throw it into the car.,0,0,1,0,0
,It was a good part-time job with flexible schedules and great people to work with.,0,0,1,0,0
,I breathed deeply and closed my eyes.,0,1,1,0,0
,She's just like the one she wanted to be with.,0,0,1,0,0
,The water on which Jesus walked and the lake in which he calmed down are both present in this lake.,0,0,1,0,1
,"At least my knee doesn't seem broken, even though they're sending the X-rays to a specialist to be sure.",0,1,1,0,0
,There was a Rap song when we pressed to play.,0,0,1,0,1
,I get hungry when I smoke weed alone.,0,0,1,0,0
,The boys raised the flag while I hit the last liter of wine after we cleaned another 15-20 liters.,0,0,1,0,0
,"Six months ago, I stood in front of a fountain with a bright penny in my hand, in a strange new place.",0,0,1,0,0
,"The priest must have pityed me because of the rain, because my hands were occupied and because he thought I was hot.",0,0,1,0,0
,I love you from the bottom to the top of my heart.,0,0,1,0,0
,I'm going to summarize it from this point on.,0,0,1,0,0
,"We went out for pizza and had a great conversation, but then one of her friends came to talk about her new boyfriend, and we had to stop.",0,1,1,1,1
,"You can share mine, I have a lot.",0,0,1,0,0
,"I ate and drank well, my legs felt fresh, and I felt on the ball after a blink of an eye.",0,0,1,0,0
,I was called out of the sea by my dancing ankle.,0,0,1,0,0
,The best class of my life.,0,1,1,1,1
,That's how you stop a zombie apocalypse.,0,0,1,0,1
,She put her hand on my chest when I pulled her back in.,0,0,1,0,0
,The other just let one word out when I swiped my head in the box to see how they were doing.,0,0,1,0,1
,I was on a date with a woman.,0,0,1,0,0
,My mouth is watering.,0,0,1,0,0
,The creamy beige wear powder foundation is for $3.45.,0,0,1,0,0
,The waiter boxed the salad.,0,0,1,0,0
,I went out where it was behind my back while we were swimming.,0,1,1,0,0
,I'm crossing my fingers that there will be a snowy day.,0,1,1,0,0
,"I think my neck could heal completely, which is different from what I thought before.",0,0,1,0,0
,This thread is perfect.,0,0,1,0,0
,There were a lot of foreign students at the university.,0,0,1,0,0
,"It was nice, but when I was half asleep, I didn't want to wake up anymore, so I went to sleep and watched the sunrise for a few moments.",0,0,1,0,0
,"When I got off the bike, I burned my leg on the exhaust.",0,1,1,0,0
,"He, his family and his friends were what I imagined a whole life for.",0,0,1,0,0
,I remember a pirate.,0,0,1,1,0
,I spent a lot of time in the desert.,0,0,1,0,0
,You have no fear.,0,0,1,0,0
,"I turned her away, I looked at the other puppies, I played, and I did all the little ""tests"" but, every time someone got rid of it, the little puppy came up and licked my hand.",0,0,1,0,0
,I used to work for an energy company that asked the right questions about the distribution gap.,0,0,1,0,0
,I closed my eyes after my head hit the pillow.,0,0,1,0,0
,"I opened it with my middle and index fingers, because it was still on my heart.",0,0,1,0,0
,I was blown up by it.,0,0,1,0,0
,"Sometimes I say ""ay-oh, I have to let go, I want to celebrate it and live my life, baby let's go, we're going to rock this club.""",0,0,1,0,0
,He chooses three after I explain the promotion to them.,0,0,1,0,1
,The heat went through my face.,0,0,1,0,0
,She ran into my arms when she turned around the corner.,0,0,1,0,1
,I will get my nala kittens back in my arms in a week or so.,0,0,1,0,0
,We need to get him home.,0,0,1,0,0
,I took those written on my hands.,0,0,1,0,0
,The counselor testified in detail.,0,1,1,0,0
,"Although it was a pretty fancy wedding, I tried to make it as easy as possible.",0,0,1,0,0
,The tooth fairy paid for my teeth in quarters.,0,0,1,0,0
,The hair of my arms started to rise as I saw the old tradition of holding lighters in the deep crowd.,0,1,1,0,0
,I opened my eyes after stretching until my toes were taken by the sheets.,0,0,1,0,0
,I said something that was safe.,0,0,1,0,0
,We practiced.,0,0,1,0,0
,Let's go back to the gym.,0,0,1,0,0
,I closed my eyes and heard him run over me while he smiled at me and shook his head.,0,0,1,0,0
,"My ankle was ruined on the easy sidewalk this winter, so I need to get back on some technical trails.",0,0,1,0,0
,The blonde hit me with a conversation.,0,0,1,0,1
,He would be his great-grandson.,0,0,1,0,1
,My jaw almost fell off the kitchen floor as I looked at the photos.,0,1,1,0,1
,I always won because he had 888-405-7720 888-405-7720,0,0,1,0,1
,We became friends after knocking ourselves out.,0,0,1,0,0
,It's a relief to be able to write about what's happening in my head and what's happening in my life.,0,0,1,0,0
,Everything was perfect for a while.,0,0,1,0,0
,"I stopped taking care of two because I really didn't want to know, and the natural progression of the exam is to move to the hair on the head.",0,0,1,0,1
,She was raising her children and then getting old.,0,0,1,1,0
,"After unpacking the car, I jumped on my back.",0,0,1,0,0
,She was very happy for him.,0,0,1,0,0
,The puppy licked my nails when it crawled on my feet.,0,0,1,0,0
,I yelled at my head and smiled.,0,0,1,0,0
,"I have my left leg, my foot, the back of my neck, and my hand.",0,0,1,0,0
,My grandma is touching my hand.,0,0,1,0,0
,I have a bit of time on my hands.,0,0,1,0,0
,I relaxed for a while.,0,0,1,0,0
,"I entered the voting position, which was so small that I had to hit my head to get in.",0,0,1,0,1
,They were dancing to Bolero.,0,0,1,0,0
,Turn away while falling asleep.,0,0,1,1,0
,Someone else is trying to win my heart.,0,1,1,0,0
,"I saw the trailer first, and it was interesting, and I created my own story from it.",0,0,1,0,0
,"This big cracker was made of 80% heart, 5% muscle, and 5% brain.",0,0,1,0,1
,Let's hit him.,0,0,1,0,0
,"I could have laughed at my head, but I had to keep my head in place so I could laugh again.",0,0,1,0,0
,"On the 11th, my doctor told me that he didn't find anything wrong with my spine or the back bone.",0,0,1,0,0
,"Being an internet company, it was important that internet worked.",0,1,1,0,0
,A group of people met for dinner in a restaurant.,0,0,1,0,0
,I feel like falling.,0,0,1,0,0
,Scouts are dressed as farts.,0,0,1,0,1
,I still remember this from time to time.,0,0,1,1,1
,"I had a hard time reaching the HR target, even in the lower gear, but I still have a nice burn in my legs.",0,0,1,0,0
,We climbed through the shallow water and were looking for rocks and other objects in the river.,0,0,1,0,0
,A young child sitting on the couch in my basement eating ice.,0,0,1,0,0
,I have to take care of my grandson while my back hurts.,0,0,1,1,0
,I wonder if I just made my first ghost poo.,0,1,1,0,1
,I had so many ideas when we walked.,0,0,1,0,0
,"I wrote this about one of my first school memories as part of a writing exercise on memory as a tool, and I've been dying to share it as I think it's pretty funny.",0,0,1,0,0
,Everything that used to feel wrong suddenly feels right as my heart finally begins to feel peace.,0,0,1,0,0
,"Despite the fact that the city is called Sin City, the city of Las Vegas captures my eye because my favorite movie is set in the city.",0,0,1,0,0
,"My back hurts, I've been suffering bad depression since my parents were here this weekend, and I have new towels, but I'm an old lady.",0,1,1,1,0
,I decided to let out a fart when I walked in the aisle of the toilet.,0,0,1,0,1
,"I don't have a full use of my shoulder yet, but it was great to drive again.",0,0,1,0,0
,We're going to a house party at two o'clock in the morning.,0,1,1,0,1
,"It was implacable joy, as if a smile were constantly on my face, and even when it wasn't, it was still ready to come out.",0,0,1,0,0
,A close friend dated me on February 14th with her boyfriend and her friend.,0,1,1,0,1
,"When I changed my mind, it changed my heart.",0,0,1,0,0
,The scent of the cologne made me feel good.,0,0,1,0,0
,I have always wanted to see one.,0,0,1,0,1
,"He licked my head, combed my hair and breathed in.",0,0,1,0,0
,I was on a rush.,0,1,1,0,1
,"He put it in front of the mirror and said, ""Look, look at you!""",0,0,1,0,1
,My inner need to analyze and be obsessed is dead after I adjusted the noise in my head.,0,1,1,0,0
,The squirrel jumped on my arm and shoulder after I stopped moving.,0,0,1,0,0
,He ate my brain when I watched Tangled.,0,0,1,0,1
,"I made sure to run my hand along the wall, knowing that Brad Pitt, George Clooney, and Matt Damon had stood there.",0,0,1,1,0
,I understand the impulse to eat the pizza I'm shoving into your face.,0,0,1,0,0
,"All right, my God.",0,1,1,0,1
,I noticed that the water didn't hit my eyes when I realized I was wearing sunglasses.,0,0,1,0,1
,"I loved watching the planes fly over us, but this one plane flew in the opposite direction.",0,0,1,0,1
,It was intriguing.,0,1,1,0,1
,I shouted my heart because they played the majority of the classics.,0,0,1,0,0
,"When I put my head against Glen's chest, his heartbeat is strong against my ear, and my mind is moving outside of this sky.",0,0,1,0,0
,The cop told him to have a good day.,1,0,1,0,1
,I close my eyes and think that I'm almost there.,0,0,1,0,0
,Then fall in love again.,0,0,1,0,1
,Happy birthday to you and me!,0,0,1,0,0
,I'm getting tired all the time and my belly is getting firm.,0,1,1,1,0
,"He said yes, and I closed my eyes and sang two lines about my desires for him.",0,0,1,0,0
,Some of the nice ones were insulted.,1,0,1,0,0
,We order almost the entire menu at the drive through.,0,0,1,0,0
,He let a warm breath escape from his mouth as he tossed his arms around me.,0,0,1,0,0
,My heart is throbbing with joy.,0,0,1,0,0
,"My brother thought his way of telling me who I was was pretty funny, but I was unaware that he knew who I was.",0,0,1,0,1
,I fell asleep quickly.,0,0,1,0,0
,"As I opened them, everything seemed to fall before my eyes, like a liquid tent.",0,1,1,0,1
,They were playing in the fields and looking for something to shoot at.,0,1,1,0,0
,I have a lot more.,0,0,1,0,0
,We will eliminate racism when we stop making distinctions.,0,0,1,0,0
,She invited me to her birthday party.,0,0,1,0,0
,I can't get Steve Wonder Written on the Walls' from my head.,0,1,1,0,0
,"It became quite the chic outlet for my extreme and sometimes unbearable quirks, as well as some of my innermost thoughts, which I wanted to tell the elect that I love and hold close to my heart.",0,0,1,0,0
,They may have seen the appearance of ecstasy on my face as I sped up and slowed down.,0,0,1,0,0
,She was impressive.,0,0,1,0,1
,I felt pleasure as I dropped my jaw.,0,0,1,0,1
,I had my eyes looked at.,0,0,1,0,0
,It's the first week of typing and my legs felt great all week long.,0,0,1,0,1
,I've been interested in kidnapping stories for a long time.,0,1,1,0,0
,We wake up at the same time.,0,0,1,0,0
,"It's terrible, but at least I'm 25.",1,1,1,1,1
,"The view from above was amazing, with the river wandering out of the gorge and thousands of wild flowers in bloom.",0,0,1,0,0
,I've taken pictures of what happened to me.,0,0,1,0,0
,He's a nice guy trying to help girls.,0,0,1,0,0
,I used rock music to keep my eyes open while listening to my radio.,0,1,1,0,0
,I can't wait to get my hands on that wall space.,0,0,1,0,0
,I ate soup and pudding.,0,0,1,0,0
,We've been friends ever since.,0,0,1,0,0
,"I crossed my arms and said, ""I thought you were supposed to be in Austria?""",0,0,1,0,0
,"Every time Billy makes it to class, we cheer and clap until he dies.",0,0,1,1,0
,Our careers of perspective were successful at the same time.,0,0,1,0,0
,I dared to raise the camera in my eye.,0,1,1,0,0
,"The location, car brand, model, color, impact mode, and impact vehicle were all correct.",0,0,1,0,1
,No children were hurt.,0,0,1,0,0
,"It's strange, because I'm usually the first one to complain about the cold, but still, I want to drink Cafe Frangelica at home.",0,0,1,0,0
,"I took a bath that felt good and I brushed my teeth and washed my hair, so give me some credit.",0,0,1,1,0
,I had two sinks in my bathroom and a cup cutter in my room at the hotel that we stayed in.,0,0,1,0,0
,I chuckled and sat on my chair.,0,0,1,0,0
,"Second time, 6 Mo.",0,0,1,0,0
,The guy was interested in me.,0,0,1,0,1
,"I hear someone call a girl by ""Rain!"" during a festival miles away from home.",0,0,1,0,1
,The fact that they all have the same aura is remarkable.,0,0,1,0,0
,The store erupted in cheers and applause.,0,0,1,0,1
,My legs and arms saw the sun for the first time in a long time.,0,0,1,0,0
,I'm going to put one of those boxes under my arm and go back to the living room.,0,0,1,0,0
,Her face was priceless.,0,0,1,0,1
,"I enjoyed one of my best poops in history, it was huge, it was liquid and it smelled great.",0,0,1,0,0
,I had peace in my heart.,0,0,1,0,0
,I thought it would be a good time to take a nap.,0,0,1,0,0
,The bumper sticker made me smile.,0,0,1,0,1
,One of the first shows where S ren went was with Pete Seeger and Jim White.,0,0,1,0,0
,I would burn my downloaded music on cheap CDs.,0,0,1,0,0
,My long brown hair wrapped me around my ear.,0,0,1,0,0
,I jumped at my feet.,0,0,1,0,0
,He took a picture and followed the laughs.,0,1,1,0,1
,I rolled over in my cane and yawned.,0,0,1,0,0
,I brushed my teeth and started playing a maple story.,0,0,1,0,0
,"You make me happy, fall out of bed, and sing like a bird.",0,0,1,0,0
,I stopped at a turn in the road that led to a sunny valley.,0,0,1,0,0
,"I adore you, boy.",0,0,1,0,0
,I opened my eyes.,0,0,1,0,0
,I had a new beer in my hand when he bought the first one.,0,0,1,0,0
,"After sleeping on the floor for more than 3 weeks, my back loves the fact that I have my own room.",0,0,1,0,0
,"With no pedals under my feet, my muscles relax with the feeling of empty hands.",0,0,1,0,0
,His car was starting the road as the sun came out.,0,1,1,0,1
,I bounced stronger after stretching my arms.,0,0,1,0,0
,My wife and I bought a new house after my son was born.,0,0,1,0,0
,We spent the whole day together and got pizza and a ton of beer.,0,0,1,0,0
,The stranger is left speechless and confused.,0,1,1,0,1
,"Callie takes note of my tone, getting used to my thanks murmuring in response to all the attendees who had already been there, and puts her hand at the base of my spine.",0,0,1,0,0
,A beautiful bag of ice was prepared by the waitress after she had an experience of physical therapy.,0,0,1,0,0
,"I knew it was on this section where I had fought, but I was able to avoid the urge to grab a few brakes and close my eyes.",0,1,1,0,0
,The bark turns at my side and twinkles as I draw with my fingers.,0,0,1,0,0
,Pull my heels up.,0,0,1,0,0
,"I did this without counting, so it's good to know that I'm eating well without having to write things down.",0,0,1,0,0
,I calmed down after rationalizing a bit.,0,1,1,0,0
,I have a brilliant idea that I need to stop being like this and go with this girl in the elevator.,0,1,1,1,1
,I didn't go through this.,0,1,1,0,0
,"Despite my growth in another place, I still felt a claim toCalgary, a place that hurt my bones.",0,0,1,0,0
,I have a lot of extra time on my hands.,0,0,1,0,0
,My worst birthday is not a terrible birthday.,0,0,1,1,0
,"I woke up this morning with my arms, back and sides in pain.",0,0,1,0,0
,She found her father and gave him a stone that she had found on the side.,0,0,1,0,0
,"My doctor gave me the word pheochromocytoma three days ago after showing me my laboratory tests, after I prayed on my knees for a diagnosis.",0,1,1,1,0
,I lost my legs and started doing yoga when I arrived.,0,0,1,0,0
,It was a great night.,0,0,1,0,0
,Dinner with a woman in an open relationship.,0,1,1,0,0
,I was surprised to be able to wear my Coach without my toes being cold.,0,0,1,0,1
,I get up every day because I lie down and keep a smile on my face through all the boss problems.,0,0,1,0,0
,That made me think a little bit.,0,0,1,0,0
,Do not trust a fart.,0,1,1,0,0
