id,text,anger,fear,joy,sadness,surprise
eng_train_track_a_01110,"In my brain, I knew it's nothing serious, but my eyes darted away while my hands looked for something to occupy automatically.",0,1,0,0,0
eng_train_track_a_01111,"This will probably get buried, but here goes:",0,1,0,0,1
eng_train_track_a_01112,The bride floated down the aisle like a pageant queen.,0,0,1,0,1
eng_train_track_a_01113,Instinctively I turned my head to see who was coming in.,0,1,0,0,0
eng_train_track_a_01114,Anyway we've been married almost nine years.,0,0,1,0,0
eng_train_track_a_01115,I did as little as possible with my right hand on Sunday and took a long nap with my hand in an elevated and comfortable position Sunday afternoon.,0,0,0,0,0
eng_train_track_a_01116,"The hike was pleasant enough at first, walking on a slight incline, enjoying the scenery and the multitude of grasshoppers ( sweet jaysis, some of them were soooo big I'm sure they had skeletons ) almost flying into my face every step or so, I thought `` Ah!",0,1,1,0,1
eng_train_track_a_01117,"My elbow has some roadrash, once again through the jacket.",0,1,0,0,0
eng_train_track_a_01118,"This is what I recall... There was a sheet draped across my belly, vertically, so I couldn't see what was going on.",0,1,0,0,0
eng_train_track_a_01119,The black panther is here!.,0,1,0,0,1
eng_train_track_a_01120,I have many memories of him sitting across from me and sucking on a pig's foot while I wrinkled my nose in disgust.,0,0,0,0,0
eng_train_track_a_01121,"As my friend Steve called for better directions and as he was getting them, I fell again thinking I could break and quickly put my foot on the curb.",0,1,0,1,0
eng_train_track_a_01122,So far in this class my eyes have been opened to the power of writing and the enjoyment it can bring to me.,0,0,1,0,0
eng_train_track_a_01123,Then Bodybag was on my case and was ordering a cell search and people were shoving the `` uppers '' into my hands to which I was there trying to hide them in my pockets and such.,1,1,0,0,0
eng_train_track_a_01124,"The front page caught my eye; on it was a lengthy list of medical conditions, some five hundred or so altogether.",0,1,0,0,1
eng_train_track_a_01125,It was up-hill to get to school.....and up-hill again walking back home.,0,1,0,1,0
eng_train_track_a_01126,"` Captain, ' Ianto said timidly, poking his head around the door.",0,1,0,0,0
eng_train_track_a_01127,"(yikes, no pun intended--on either count)",0,1,1,0,1
eng_train_track_a_01128,strange that happened to me once long ago.,0,1,0,0,1
eng_train_track_a_01129,Talked with a lady online and we decided to meet.,0,1,1,0,0
eng_train_track_a_01130,The trap door was wide open.,0,1,0,0,1
eng_train_track_a_01131,"But, when I feel the sand under my feet, hear the roar of the waves and the strength of the gulf winds pushing and pulling the water in a sacred motion, all else is gone.",0,0,1,0,0
eng_train_track_a_01132,"bummed Well, I have survived the colonoscopy and the scope down my throat.",0,1,0,1,0
eng_train_track_a_01133,I was like wtf.,1,0,0,0,1
eng_train_track_a_01134,By the time Tuesday afternoon came my brain was gone.,0,1,0,1,0
eng_train_track_a_01135,here's the problem; i itch so bad i want to rip off my skin.,0,1,0,0,0
eng_train_track_a_01136,and my entire right leg up to my hip was still sleeping.,0,0,0,0,0
eng_train_track_a_01137,"I whirl around, of course, and see nothing.",0,1,0,0,1
eng_train_track_a_01138,"Suddenly another plane was involved, heading for Washington and my heart stopped beating for a few seconds as the implications of what was happening took me to my knees.",0,1,0,1,1
eng_train_track_a_01139,"Images of him dominating in all ways filled my head, haunting my dreams and fueling my fantasies.",0,1,0,1,0
eng_train_track_a_01140,"I land off-kilter and go crashing into the drum set and take a Hi-Hat to the center of my spine, severing my nerves and leaving me paralyzed.",1,1,0,1,1
eng_train_track_a_01141,I'm so sorry.,0,0,0,1,0
eng_train_track_a_01142,The whole bathroom was very elegant and nicely decorated.,0,0,1,0,0
eng_train_track_a_01143,Either way I was scared for my life that day...,0,1,0,0,0
eng_train_track_a_01144,"she is so intrusive in my life, I have issues at work.",1,1,0,1,0
eng_train_track_a_01145,There is so much going threw my head right now it's,0,1,0,0,0
eng_train_track_a_01146,"I went to an off broadway show, which was a wedding.",0,0,1,0,1
eng_train_track_a_01147,"The brace however squeezes my leg flesh out the top and bottom of the brace, and makes my knee cap look like a brain when I straighten my leg, but whatever.",0,0,0,0,0
eng_train_track_a_01148,I politely decline and went home.,0,0,0,0,0
eng_train_track_a_01149,Then I got to a parking lot and got a funny idea in my head to toss it at a car.,0,0,1,0,0
eng_train_track_a_01150,My venomous snake story is less awesome but the end result is the same:,0,1,0,0,0
eng_train_track_a_01151,What demon likes peas?,0,0,0,0,1
eng_train_track_a_01152,"The ocean wind is cold and howling in my face, easing a sharp stream of tears out of the left eye.",0,1,0,1,0
eng_train_track_a_01153,"It was a good part time job, with flexible hours and great people to work with.",0,0,1,0,0
eng_train_track_a_01154,I closed my eyes and took a deep breath.,0,1,1,0,0
eng_train_track_a_01155,I turned around so I could see my back.,0,0,0,0,1
eng_train_track_a_01156,"She is a nice religious girl, exactly like the one he wanted to be with.",0,0,1,0,0
eng_train_track_a_01157,"My heart is broke, There's nothing to steal.",0,0,0,1,0
eng_train_track_a_01158,"""How the hell did you get her down?!",1,1,0,0,1
eng_train_track_a_01159,"Ok, I'll tell you something which is both very creepy and very, very real.",0,1,0,0,1
eng_train_track_a_01160,The next day I got a tetanus shot.,0,1,0,0,0
eng_train_track_a_01161,Got tired roaming' and bumming' around,0,0,0,1,0
eng_train_track_a_01162,They kept me at the hospital for 24 hours-and suggested I try to stay off my feet as much as possible.,0,1,0,1,0
eng_train_track_a_01163,"This leads to the neeed to suffle around and makes my legs fall asleep after not too long, which obviously isn't advisable.",0,1,0,0,0
eng_train_track_a_01164,"this lake... that my feet are now standing in... is not only the lake that Jesus calmed in mark 4, but it is also the very water that Jesus walked on!",0,0,1,0,1
eng_train_track_a_01165,"Just got x-rays, and at least my knee does not appear to be broken ( although they are sending the x-rays to a specialist to be sure ).",0,1,1,0,0
eng_train_track_a_01166,"My dad was in the car, my mom was signing medical consents, and my sister was holding my hand and telling me to breath to keep me calm.",0,1,0,1,0
eng_train_track_a_01167,"Needless to say, the plant died from her residual evil.",1,0,0,0,1
eng_train_track_a_01168,"Everyone was rather distraught, as he was widely liked and respected.",0,1,0,1,0
eng_train_track_a_01169,"The room was small but brightly lit and I sat on a two-seater couch facing the counselor across the room, as opposed to lounging on my back while staring at the ceiling with the lights dimmed.So what did I learn?",0,0,0,0,0
eng_train_track_a_01170,"Well, I was being nice and throwing our trash away at Sonic... he started to back up, so I slammed my hands on the front of the car, so he started to pull forward... I laughed, finding it funny, and then I slowly realized that the car was against my shins and my feet were under the bumper of the car.......",0,1,0,0,1
eng_train_track_a_01171,"We pressed play, and some Rap song came on.",0,0,1,0,1
eng_train_track_a_01172,I smoke weed alone I have a tendency to become hungry.,0,0,1,0,0
eng_train_track_a_01173,"""I forget, but I never forgive!",1,0,0,0,0
eng_train_track_a_01174,We cleaned up another 15-20 litres of wine and finished up by the boys lifting the flagon to my mouth while I sculled the last litre or so.,0,0,1,0,0
eng_train_track_a_01175,I wish there was some way to know which dreams were going to come true.,0,1,0,1,1
eng_train_track_a_01176,my knees are banged to shit tho.,0,0,0,1,0
eng_train_track_a_01177,"My prep nurse Deborah ( went by Debbie ( Which I thought was great because I really wanted my mom with me, but it wasn't possible with a C-Section ) ) Held my hand and told me to sit very still.",0,1,0,0,0
eng_train_track_a_01178,"It was a call from the company whose offer i had accepted, saying that on the medical check up ( i signed the contract before i went on med.check ); my lungs doesn't seem well.",0,1,0,1,0
eng_train_track_a_01179,"hopeful Six months ago, I stood in a strange new place, my strange new home, in front of a fountain with a shiny penny in my hand.",0,0,1,0,0
eng_train_track_a_01180,"The priest must have taken pity on me because of the rain, because my hands were otherwise engaged, and apparently because he thought I looked smokin ' hot.",0,0,1,0,0
eng_train_track_a_01181,Sure enough - same car.,0,0,0,0,1
eng_train_track_a_01182,p / s: iloveyou guys from the bottom until the top of my heart.,0,0,1,0,0
eng_train_track_a_01183,"Man, I was wrong.",0,0,0,1,1
eng_train_track_a_01184,"Scariest part is when I couldn't move my body, with my conscious aware of everything and not being able to breathe.",0,1,0,1,1
eng_train_track_a_01185,I cringe because I have a morbid fear of STDs.,0,1,0,0,0
eng_train_track_a_01186,"The monster was right in front of me and gripped my arms tightly, giving me no chance to escape.",0,1,0,0,0
eng_train_track_a_01187,She sat me in the chair and spent a total of 30 seconds looking in my mouth.,0,0,0,0,0
eng_train_track_a_01188,"Being insensitive and ignorant like that is completely uncalled for and that just made me sick.Even more, there are a couple people that get under my skin a bit.",1,0,0,1,0
eng_train_track_a_01189,"He happened to be wearing two leather jackets at the time, so the machete only cut halfway through his arm right below the elbow.",0,1,0,1,1
eng_train_track_a_01190,"There isn't a lot left, so I'm going to summarize from this point on.",0,0,1,0,0
eng_train_track_a_01191,"We went out for pizza, everything was grand -- great conversation, no awkwardness -- until a friend of hers came up and started chatting, and then congratulated her on her new boyfriend, etc.",0,1,1,1,1
eng_train_track_a_01192,Instead I have to go down there to find them all drinking.,1,0,0,0,0
eng_train_track_a_01193,"""Well I have loads, you can share mine"".",0,0,1,0,0
eng_train_track_a_01194,My foot was tingling for sometime afterwards but the pain was mostly gone and there was no more grinding sensation.,0,1,0,0,0
eng_train_track_a_01195,"I was eating and drinking well, my legs felt fresh, and other than a twinge in my achilles tendon, I felt on the ball.",0,0,1,0,0
eng_train_track_a_01196,I pulled a shard of bone out of my mouth.,0,1,0,0,0
eng_train_track_a_01197,"By Sharlyn Guthrie From the sea fate called to me, harmless ` round my ankles danced.",0,0,1,0,0
eng_train_track_a_01198,Best/worst physics class of my life.,0,1,1,1,1
eng_train_track_a_01199,"He went and cried, literally cried, to the guidance counselor.",0,0,0,1,1
eng_train_track_a_01200,"Bitch daniel splashed fish water @ my face, lmfao.",1,0,0,0,0
eng_train_track_a_01201,The grip on my wrist tightened and my arm throbbed from the pressure.,1,1,0,0,0
eng_train_track_a_01202,That is how you single-handedly stop a zombie apocalypse.,0,0,1,0,1
eng_train_track_a_01203,"When I pulled her back in, her hand went to the perfect spot on my chest.",0,0,1,0,0
eng_train_track_a_01204,"When I poked my head in the box to see how they were doing, the other one just let out a single peep!",0,0,1,0,1
eng_train_track_a_01205,"I could still feel glass showering down and now the cut on my head was bleeding pretty badly, I could taste the blood as it ran down my face and mixed with my sweat and hit my lips.",0,1,0,1,0
eng_train_track_a_01206,We broke up twice.,1,1,0,1,0
eng_train_track_a_01207,"The whole class turned to look at me and i felt my cheeks flame up a wonderul crimson colour as I tried to bury my head back into my book, i wanted to look back up take one more glimpse at her but I daren't.",0,1,0,1,0
eng_train_track_a_01208,I was on a date with this woman.,0,0,1,0,0
eng_train_track_a_01209,My parents blame me.,1,1,0,1,0
eng_train_track_a_01210,"The interesting part is, i hear nothing.",0,1,0,0,1
eng_train_track_a_01211,"I dropped her at her house, assumed she thought it went as badly as I did, and thought nothing more of it.",0,0,0,1,0
eng_train_track_a_01212,mmm... my mouth is watering just thinking about it!,0,0,1,0,0
eng_train_track_a_01213,"She staggered backwards, hit her head hard enough on the wall to leave a dent, and slumped down.",0,1,0,1,1
eng_train_track_a_01214,It was a mess.,1,1,0,1,0
eng_train_track_a_01215,"They were filled with garbage, dirty clothes, and empty tampon containers.",1,1,0,1,1
eng_train_track_a_01216,"and sometimes an elbow to your side makes you realize that you better get moving too!time waits for no man, tom waites makes my spine tremble, and thyme makes a good spice.",0,1,0,0,0
eng_train_track_a_01217,So I got my hand on the Healthy wear powder foundation in creamy beige for $ 3.45.,0,0,1,0,0
eng_train_track_a_01218,"There was the tiniest pause in my head for a moment, as I looked round at her.",0,1,0,0,0
eng_train_track_a_01219,for puttin my heart into it n come out cryin n sad.,0,0,0,1,0
eng_train_track_a_01220,His life was hell.,0,1,0,1,0
eng_train_track_a_01221,The waiter obliged though and did box the salad.,0,0,1,0,0
eng_train_track_a_01222,And soon well need more cabbage and potatoes.,0,0,0,0,0
eng_train_track_a_01223,"It was probably about 21:00, either way it had already gone very dark (was possibly winter time).",0,1,0,0,0
eng_train_track_a_01224,"While we were swimming, I went out where it was almost to my shoulders.",0,1,1,0,0
eng_train_track_a_01225,I still have a blank stare on my face.,0,0,0,0,0
eng_train_track_a_01226,"At one point, I got pissed at Bryce for holding my hands back while my cell phone rang.",1,0,0,0,0
eng_train_track_a_01227,That thing was there.,0,1,0,0,1
eng_train_track_a_01228,"There, I was just inches away from him and for some reason, I felt the beating of my heart jump out from within me.",0,1,0,0,1
eng_train_track_a_01229,it's currently snowing big flakes outside and i'm crossing my fingers and hoping for a snow day.,0,1,1,0,0
eng_train_track_a_01230,Nothing but the dark.,0,1,0,1,0
eng_train_track_a_01231,She never went through general anesthesia again.,0,1,0,1,0
eng_train_track_a_01232,`` So this is what is going through my head today while I try to tackle an immense amount of work.,0,1,0,0,0
eng_train_track_a_01233,My face was just not meant to smile.,1,0,0,1,0
eng_train_track_a_01234,The best I could offer was a small keloid scar on the meaty part of my palm from busting a glass while washing dishes.,0,0,0,0,0
eng_train_track_a_01235,A penny hit me square in the face.,1,1,0,0,1
eng_train_track_a_01236,At this point I am confident that my neck could actually heal completely which is unlike how I felt about it previously.,0,0,1,0,0
eng_train_track_a_01237,Got me so far?,0,0,0,0,0
eng_train_track_a_01238,Thoight it was weird.,0,1,0,0,1
eng_train_track_a_01239,I was just crying so hard that the tears dripped off my chin and into the sink ).,0,1,0,1,0
eng_train_track_a_01240,Idk what to believe..,0,1,0,1,1
eng_train_track_a_01241,' So I held it up to my face and waved at it before swallowing it.We got home around 8:30 AM.,0,0,0,0,1
eng_train_track_a_01242,"Makeing a sorta clam shell, or like someone praying but sideways., around my clentched fist.",0,1,0,0,0
eng_train_track_a_01243,"A voice from below begged, pleaded to be unburied.",0,1,0,1,1
eng_train_track_a_01244,I woke up around 10:30 with a million thoughts rolling through my head.,0,1,0,0,0
eng_train_track_a_01245,I caught a co-worker stealing my prescription migraine medicine.,1,1,0,0,1
eng_train_track_a_01246,Another seventeen were sent to the hospital.,0,1,0,1,1
eng_train_track_a_01247,We've never met.,0,0,0,0,1
eng_train_track_a_01248,"Shitty situation, dont protect yourself with guns unless shots have already been fired.",1,1,0,0,0
eng_train_track_a_01249,I looked down only to see a flashing red light buried in the dirt under my feet.,0,1,0,0,1
eng_train_track_a_01250,"I'm tired of fighting against you Life, I'm tired of getting up and going into work day after day even when I'm sick to my stomach and my head's throbbing.",1,1,0,1,0
eng_train_track_a_01251,"Oh, this thread is perfect.",0,0,1,0,0
eng_train_track_a_01252,Tears streaming down my face I say '' let this end be because of my own making. '',0,1,0,1,0
eng_train_track_a_01253,Every september I used to get a wicked case due to fluid in my ears caused by allergies.,0,1,0,1,0
eng_train_track_a_01254,i can see him staring from the corner of my eye i take a small glance and ask myself `` why? '',0,1,0,0,1
eng_train_track_a_01255,""" We don't have anything that they want, so they told me.",0,1,0,1,1
eng_train_track_a_01256,She lived in the boonies &amp; one night she was getting ready for bed when she glanced out the window &amp; saw a red flicker.,0,1,0,0,1
eng_train_track_a_01257,"Crazy.Anyway, my feet & knees still hurt this morning.",0,1,0,0,0
eng_train_track_a_01258,"I then started to cry again, with a doll in my arms.",0,0,0,1,0
eng_train_track_a_01259,My head smashed into the roof of it hard enough to drive every thought from my head.,1,1,0,0,0
eng_train_track_a_01260,I was sweating and panicked.,0,1,0,0,0
eng_train_track_a_01261,Meaningless at the time.,0,0,0,1,0
eng_train_track_a_01262,"It was dark but I could see my door was slightly open, and on the other side was from what I could tell a giant eye.",0,1,0,0,1
eng_train_track_a_01263,In college we had a lot of foreign students at school.,0,0,1,0,0
eng_train_track_a_01264,It was really beautiful but being half asleep I didn't want to wake up anymore and so I kept dozing in and out of sleep watching the sunrise for a few moments before closing my eyes again and drifting off to sleep.,0,0,1,0,0
eng_train_track_a_01265,Now I am resting and I have to do my ear drops again.,0,1,0,0,0
eng_train_track_a_01266,I can see it in my head.,0,0,0,0,0
eng_train_track_a_01267,"It was a joyously frightening ride and as I went to get off the bike, I burned my leg on the exhaust.",0,1,1,0,0
eng_train_track_a_01268,"""That's were those people went missing"".",0,1,0,1,1
eng_train_track_a_01269,It was so fucking weird.,0,1,0,0,1
eng_train_track_a_01270,"Jamming the finger in my mouth to suck on, I open my stinging eyes and look over to my nightstand.",0,1,0,1,0
eng_train_track_a_01271,"), and I've imagined an entire life for him, his family, and his friends.",0,0,1,0,0
eng_train_track_a_01272,I remember Pirate Percy.,0,0,1,1,0
eng_train_track_a_01273,"I don't mind conditioning, but with my hip?",0,1,0,0,0
eng_train_track_a_01274,I shook my head.,0,0,0,0,0
eng_train_track_a_01275,"He looked over my face, my chest, and slowly down, one hand pulling open the tie on my robe.",0,0,0,0,0
eng_train_track_a_01276,"Nothing in his bed, not on his pillow, not on the bed, not on any doorhandles...nothing.",0,1,0,1,1
eng_train_track_a_01277,"As soon as I came out of the loo to wash my hands, a girl stepped out of the loo next to mine, followed by an horrendous smell.",0,1,0,0,0
eng_train_track_a_01278,What happened to my heart when it broke into pieces?,0,0,0,1,0
eng_train_track_a_01279,"I never saw that thing again, because evidently it was ""stolen"".",1,1,0,0,1
eng_train_track_a_01280,"I've spent tons of time in the desert, in the forest, camping, hiking.",0,0,1,0,0
eng_train_track_a_01281,"So the money is ""taken"" from the employees.",1,0,0,0,0
eng_train_track_a_01282,"Not too long after my family left, a guy came in to hook me up to yet another machine briefly to check my breathing which proved to be labored but not dangerously slow ( a nurse came in later a gave me a little toy thing to exercise my lungs which helped a bit ) and another couple guys came in to take an x-ray of my lungs.",0,1,0,0,0
eng_train_track_a_01283,The pain was incredible.,0,1,0,1,0
eng_train_track_a_01284,"The manager was at the till beside the front door, and the rest of us were mopping upstairs, cleaning tables and giving the staff toilet and stock room the once over.",0,0,0,0,0
eng_train_track_a_01285,I started smoking there.,0,0,0,0,0
eng_train_track_a_01286,They have nothing to fear.,0,0,1,0,0
eng_train_track_a_01287,"I pushed her away, looked at the other pups, played, and did all the little `` tests '' but, every time someone turned loose of that the little female pup, she simplly walked over, and crawled in my lap, licked my hand.",0,0,1,0,0
eng_train_track_a_01288,I used to work for a UK energy company and through asking the right people the right questions I learned about the distribution gap.,0,0,1,0,0
eng_train_track_a_01289,"During the long and high vocals at the end, hair stood up on the back of my neck.",0,1,0,0,1
eng_train_track_a_01290,I think my eyes shut immediately after my head hit that pillow.,0,0,1,0,0
eng_train_track_a_01291,My pencil is in my hand.,0,0,0,0,0
eng_train_track_a_01292,"Then while it was still on my heart, I opened it into a V with my index and middle finger.",0,0,1,0,0
eng_train_track_a_01293,where my feet couldn't get warm enough while i slept and i had to wear booties while sleeping.,0,1,0,0,0
eng_train_track_a_01294,It buoyed up my heart.,0,0,1,0,0
eng_train_track_a_01295,A former boxing coach for the Soviet Union.,0,0,0,0,1
eng_train_track_a_01296,My heart sinks.,0,1,0,1,0
eng_train_track_a_01297,"""Liutenant, we see the black patch.",0,1,0,0,1
eng_train_track_a_01298,My hands were full.,0,0,0,0,0
eng_train_track_a_01299,"I stirred the surface of the water with my hand; my face wiped away, only to reform when the mirror settled down again.",0,1,0,0,1
eng_train_track_a_01300,"I throw my hands up in the air sometimes Sayin ' ay-oh, got ta let go I wan na celebrate and live my life Sayin ' ay-oh, baby let's go 'Cause we gon ' rock this club We gon ' go all night We gon ' light it up Like it's dynamite 'Cause I told you once Now I told you twice We gon ' light it up Like it's dynamite God, I wish I could.",0,0,1,0,0
eng_train_track_a_01301,""" I explain the promotion to them and he is quick to decide he wants three.",0,0,1,0,1
eng_train_track_a_01302,"I fell to my knees, my body shaking with the sorrow I held in me since I woke up.",0,0,0,1,0
eng_train_track_a_01303,For many months I learned to shower keeping my elbows close to prevent water from hosing off the ends and totally drenching the place.,0,1,0,0,0
eng_train_track_a_01304,&lt;/crazy-nutter&gt;,0,1,0,0,1
eng_train_track_a_01305,Maybe I should try to get my hands on some.,0,0,0,0,0
eng_train_track_a_01306,"Warmth, acrossed my cheek from golden rays.",0,0,1,0,0
eng_train_track_a_01307,"As I walked in the door she came around the corner, squealing with delight and ran into my arms!",0,0,1,0,1
eng_train_track_a_01308,I go in and sit down at my usual seat.,0,0,0,0,0
eng_train_track_a_01309,"`` Well then, by all means, curl my toes. ''",0,0,0,0,0
eng_train_track_a_01310,"Ah, to close my eyes and let time fly by, Because there's so much to gain By forgetting these dreams driving me insane.",0,1,0,1,0
eng_train_track_a_01311,It started out like a small ache but as the day progressed it turned into this sharp jabbing pain in my ear.,0,1,0,0,0
eng_train_track_a_01312,I most certainly had change.,0,0,0,0,0
eng_train_track_a_01313,"I think, just a week or so until I have my Nala kitty back in my arms.",0,0,1,0,0
eng_train_track_a_01314,Quite the opposite-total sloth/stoner/drunk.,0,0,0,0,1
eng_train_track_a_01315,We haven't talked about it since.,0,0,0,1,0
eng_train_track_a_01316,"My arms reached forward, and I grabbed on to his leg.",0,0,0,0,0
eng_train_track_a_01317,"i kind of bawled my eyes out at the end; i warn you, it is highly depressing!",0,0,0,1,0
eng_train_track_a_01318,"Now, we just gotta get it home.",0,0,1,0,0
eng_train_track_a_01319,=D but i took the ones written on my hands one!,0,0,1,0,0
eng_train_track_a_01320,I went walking the other day and froze my lungs out.,0,1,0,0,0
eng_train_track_a_01321,Thankfully it was witnessed by the counselor in full detail.,0,1,1,0,0
eng_train_track_a_01322,"The other was terrible, horrible, no good, very bad.",1,0,0,1,0
eng_train_track_a_01323,"With an infant, stroller and backup, I had my hands full and I needed time to do things.",0,1,0,0,0
eng_train_track_a_01324,I get close enough to see the empty bottle and it starts moving a little.,0,1,0,0,1
eng_train_track_a_01325,What was the aftermath?,0,1,0,0,1
eng_train_track_a_01326,"At this point I am starting to have an anxiety attack, but I keep listening.",0,1,0,0,0
eng_train_track_a_01327,"Today, I ventured to swim class where Reese spent the entire 10 ( to maybe 12 ) minutes we were in the pool softly crying, almost whimpering and licking my shoulder.",0,1,0,1,0
eng_train_track_a_01328,It used its claws to tear my living room couch to shreds.,1,1,0,1,1
eng_train_track_a_01329,"So I tried to make things as simple as possible, even though it was a pretty fancy wedding (my mom's standards).",0,0,1,0,0
eng_train_track_a_01330,"The Tooth Fairy paid for my teeth in quarters, equivalent to my age in years.",0,0,1,0,0
eng_train_track_a_01331,i oblige and he says something about how i have fluid in my lungs and i need to cough it all out.,0,1,0,0,0
eng_train_track_a_01332,My nose is so stuffed up right now.,0,1,0,1,0
eng_train_track_a_01333,Sometimes I have difficulty feeling my feet-I much prefer the clouds.,0,1,0,0,0
eng_train_track_a_01334,By that point I felt like someone was stabbing my head with a sharp object.,0,1,0,0,0
eng_train_track_a_01335,"I can only knit for so long till my hands start to hurt, and I haven't been in a video gaming mood lately, so I needed something.",0,0,0,0,0
